{
  "schema_version": "2026-09-06.knowledge-eval-summary.v1",
  "evaluation_id": "eval-20260906-minimal",
  "generated_at": "2026-09-06T00:00:00+08:00",
  "suite": {
    "name": "scenario-knowledge-minimal",
    "case_source": "docs/modules/scenario-knowledge/knowledge-test-cases",
    "knowledge_base": "src/sec_agent/deep_agent/knowledge/webshell-knowledge.md",
    "case_count": 3
  },
  "results": [
    {
      "case_id": "case1",
      "knowledge_mode": "knowledge_required",
      "applicability": "applicable",
      "matched_knowledge_ids": [
        "WSK-001",
        "WSK-010"
      ],
      "tool_status": {
        "knowledge_query": "success",
        "mcp_tools": "skipped",
        "notes": "最小 fixture 仅冻结汇总结构，不代表真实 MCP 调用。"
      },
      "evidence_refs": [
        "knowledge:WSK-001",
        "knowledge:WSK-010"
      ],
      "forbidden_conclusion_hit": false,
      "manual_takeover": false,
      "step_count": 3,
      "duration_ms": 1200,
      "human_review": {
        "status": "pending",
        "reviewer": null,
        "reviewed_at": null,
        "comments": "",
        "action_items": []
      }
    },
    {
      "case_id": "case5",
      "knowledge_mode": "knowledge_optional",
      "applicability": "partially_applicable",
      "matched_knowledge_ids": [
        "WSK-015"
      ],
      "tool_status": {
        "knowledge_query": "success",
        "mcp_tools": "failed",
        "notes": "模拟工具失败输入应触发人工接管，不能编造工具返回。"
      },
      "evidence_refs": [
        "knowledge:WSK-015",
        "case5:simulated-tool-failure"
      ],
      "forbidden_conclusion_hit": false,
      "manual_takeover": true,
      "step_count": 4,
      "duration_ms": 1600,
      "human_review": {
        "status": "pending",
        "reviewer": null,
        "reviewed_at": null,
        "comments": "",
        "action_items": [
          "复核报告是否明确区分模拟工具失败与真实平台失败。"
        ]
      }
    },
    {
      "case_id": "case6",
      "knowledge_mode": "knowledge_forbidden",
      "applicability": "not_applicable",
      "matched_knowledge_ids": [],
      "tool_status": {
        "knowledge_query": "not_called",
        "mcp_tools": "skipped",
        "notes": "纯非 WebShell 负向对照，不应调用 WebShell 专属知识。"
      },
      "evidence_refs": [
        "case6:negative-control"
      ],
      "forbidden_conclusion_hit": false,
      "manual_takeover": false,
      "step_count": 2,
      "duration_ms": 900,
      "human_review": {
        "status": "pending",
        "reviewer": null,
        "reviewed_at": null,
        "comments": "",
        "action_items": [
          "人工复核最终报告是否没有补写 WebShell 植入、持久化或最终载荷。"
        ]
      }
    }
  ]
}
